{
  "$schema": "https://json-schema.org/draft/2020-12/schema",
  "$id": "innerbloom://marketing/cmo-output-v1",
  "title": "Innerbloom CMO Output v1",
  "type": "object",
  "additionalProperties": false,
  "required": ["schema_version", "agent", "period", "generated_at", "review_status", "executive_summary", "input_assessment", "previous_period_analysis", "learnings", "strategic_diagnosis", "strategy", "experiments", "messaging_guidelines", "visual_direction", "head_of_content_brief", "measurement_plan", "strategy_memory_update", "source_manifest"],
  "properties": {
    "schema_version": {"const": "1.0"},
    "agent": {"const": "innerbloom_cmo"},
    "period": {"$ref": "#/$defs/periodKey"},
    "generated_at": {"type": "string", "format": "date-time"},
    "review_status": {"enum": ["draft", "approved", "rejected"]},
    "executive_summary": {"type": "string", "minLength": 1},
    "input_assessment": {"$ref": "#/$defs/freeObject"},
    "previous_period_analysis": {"$ref": "#/$defs/freeObject"},
    "learnings": {
      "type": "array",
      "minItems": 1,
      "items": {
        "type": "object",
        "additionalProperties": false,
        "required": ["learning", "evidence", "confidence", "implication"],
        "properties": {
          "learning": {"type": "string", "minLength": 1},
          "evidence": {"type": "array", "items": {"type": "string", "minLength": 1}},
          "confidence": {"enum": ["strong_signal", "moderate_signal", "weak_signal", "insufficient_evidence"]},
          "implication": {"type": "string", "minLength": 1}
        }
      }
    },
    "strategic_diagnosis": {"$ref": "#/$defs/freeObject"},
    "strategy": {
      "type": "object",
      "required": ["primary_objective", "secondary_objectives", "priority_audience", "core_value_proposition", "period_narrative", "strategic_priorities", "content_pillars", "content_mix"],
      "properties": {
        "primary_objective": {"enum": ["new_users", "leads", "activation", "awareness", "retention"]},
        "secondary_objectives": {"type": "array", "maxItems": 2, "items": {"type": "string", "minLength": 1}},
        "priority_audience": {"type": "object"},
        "core_value_proposition": {"type": "string", "minLength": 1},
        "period_narrative": {"type": "string", "minLength": 1},
        "strategic_priorities": {"type": "array", "minItems": 1, "maxItems": 3, "items": {"type": "string", "minLength": 1}},
        "content_pillars": {"type": "array", "minItems": 3, "maxItems": 5, "items": {"$ref": "#/$defs/contentPillar"}},
        "content_mix": {"type": "object"}
      }
    },
    "experiments": {"type": "array", "minItems": 2, "maxItems": 5, "items": {"$ref": "#/$defs/experiment"}},
    "messaging_guidelines": {"$ref": "#/$defs/freeObject"},
    "visual_direction": {"$ref": "#/$defs/freeObject"},
    "head_of_content_brief": {"$ref": "#/$defs/freeObject"},
    "measurement_plan": {"$ref": "#/$defs/freeObject"},
    "strategy_memory_update": {"$ref": "#/$defs/freeObject"},
    "source_manifest": {"type": "array", "items": {"type": "object"}}
  },
  "$defs": {
    "periodKey": {"type": "string", "pattern": "^\\d{4}-(0[1-9]|1[0-2])$"},
    "freeObject": {"type": "object"},
    "code": {"type": "string", "pattern": "^[a-z0-9]+(?:_[a-z0-9]+)*$"},
    "contentPillar": {
      "type": "object",
      "required": ["pillar_code", "name", "purpose", "audience_problem", "message", "proof_or_mechanism", "recommended_formats", "recommended_post_count"],
      "properties": {
        "pillar_code": {"$ref": "#/$defs/code"},
        "name": {"type": "string", "minLength": 1},
        "purpose": {"type": "string", "minLength": 1},
        "audience_problem": {"type": "string", "minLength": 1},
        "message": {"type": "string", "minLength": 1},
        "proof_or_mechanism": {"type": "string", "minLength": 1},
        "recommended_formats": {"type": "array", "minItems": 1, "uniqueItems": true, "items": {"enum": ["static", "carousel", "reel", "story"]}},
        "recommended_post_count": {"type": "integer", "minimum": 0}
      }
    },
    "experiment": {
      "type": "object",
      "required": ["experiment_code", "name", "hypothesis", "variable_being_tested", "control_or_baseline", "target_audience", "content_pillars", "primary_metric", "secondary_metrics", "success_criteria", "failure_criteria", "minimum_evidence_needed", "decision_enabled"],
      "properties": {
        "experiment_code": {"$ref": "#/$defs/code"},
        "name": {"type": "string", "minLength": 1},
        "hypothesis": {"type": "string", "minLength": 1},
        "variable_being_tested": {"type": "string", "minLength": 1},
        "control_or_baseline": {"type": "string", "minLength": 1},
        "target_audience": {"type": "string", "minLength": 1},
        "content_pillars": {"type": "array", "minItems": 1, "uniqueItems": true, "items": {"$ref": "#/$defs/code"}},
        "primary_metric": {"type": "string", "minLength": 1},
        "secondary_metrics": {"type": "array", "items": {"type": "string", "minLength": 1}},
        "success_criteria": {"type": "string", "minLength": 1},
        "failure_criteria": {"type": "string", "minLength": 1},
        "minimum_evidence_needed": {"type": "string", "minLength": 1},
        "decision_enabled": {"type": "string", "minLength": 1}
      }
    }
  }
}
